<?xml version="1.0" encoding="UTF-8"?>
<xs:schema xmlns:xs="http://www.w3.org/2001/XMLSchema">

<xs:complexType name="Person">
      <xs:sequence>
            <xs:element name="Name" type="xs:string"/>
            <xs:element name="Awards" type="xs:string" minOccurs="0"/>
      </xs:sequence>
</xs:complexType>


<xs:complexType name="PersonExtended">
      <xs:complexContent>
          <xs:extension base="Person">
                <xs:sequence>
                      <xs:element name="Company" type="xs:string"/>
                </xs:sequence>
          </xs:extension>
          </xs:complexContent>
      </xs:complexType>
<!--elemento raíz-->      
  <xs:element name="Book">
      <xs:complexType>
      <xs:sequence>
              <xs:element name="Title" type="xs:string"/>
              <xs:element name="Author" type="Person"/>
              <xs:element name="Illustrator" type="PersonExtended"   minOccurs="0"/>
        </xs:sequence>
    </xs:complexType>
</xs:element>
</xs:schema>